"No.","Mac_src","Mac_dst","Time","Source","Destination","Protocol","Length","Info"
"1","Giga-Byt_69:40:4d","Broadcast","0.000000","Giga-Byt_69:40:4d","Broadcast","ARP","60","Who has 10.10.0.100?  Tell 10.10.0.10"
"2","Netronix_aa:35:6f","Giga-Byt_69:40:4d","0.000112","Netronix_aa:35:6f","Giga-Byt_69:40:4d","ARP","60","10.10.0.100 is at 00:e0:7d:aa:35:6f"
"3","Giga-Byt_69:65:54","Giga-Byt_69:40:4d","0.000181","Giga-Byt_69:65:54","Giga-Byt_69:40:4d","ARP","60","10.10.0.100 is at 00:14:85:69:65:54"
"4","Giga-Byt_69:40:4d","Netronix_aa:35:6f","0.000602","10.10.0.10","220.210.12.10","HTTP","491","GET http://web1.isptyr.com/96363.html HTTP/1.1 "
"5","Netronix_aa:35:6f","Broadcast","0.004488","Netronix_aa:35:6f","Broadcast","ARP","60","Who has 220.210.12.10?  Tell 220.210.12.101"
"6","Giga-Byt_68:6f:e0","Netronix_aa:35:6f","0.004581","Giga-Byt_68:6f:e0","Netronix_aa:35:6f","ARP","60","220.210.12.10 is at 00:14:85:68:6f:e0"
"7","Netronix_aa:35:6f","Giga-Byt_68:6f:e0","0.005011","220.210.12.101","220.210.12.10","HTTP","491","GET http://web1.isptyr.com/96363.html HTTP/1.1 "
"8","Giga-Byt_68:6f:e0","Broadcast","0.006233","Giga-Byt_68:6f:e0","Broadcast","ARP","60","Who has 220.210.12.100?  Tell 220.210.12.10"
"9","EdimaxTe_c6:b3:41","Giga-Byt_68:6f:e0","0.006321","EdimaxTe_c6:b3:41","Giga-Byt_68:6f:e0","ARP","60","220.210.12.100 is at 00:50:fc:c6:b3:41"
"10","Giga-Byt_68:a0:74","Giga-Byt_68:6f:e0","0.006392","Giga-Byt_68:a0:74","Giga-Byt_68:6f:e0","ARP","60","220.210.12.100 is at 00:14:85:68:a0:74"
"11","Giga-Byt_68:6f:e0","EdimaxTe_c6:b3:41","0.006474","220.210.12.10","200.40.0.4","TCP","74","42450 > http [SYN] Seq=0 Win=5840 Len=0 MSS=1460 SACK_PERM=1 TSval=1924185 TSecr=0 WS=32"
"12","EdimaxTe_c6:b3:41","Broadcast","0.008031","EdimaxTe_c6:b3:41","Broadcast","ARP","60","Who has 144.22.3.1?  Tell 144.22.3.2"
"13","Giga-Byt_63:54:91","EdimaxTe_c6:b3:41","0.008118","Giga-Byt_63:54:91","EdimaxTe_c6:b3:41","ARP","60","144.22.3.1 is at 00:14:85:63:54:91"
"14","EdimaxTe_c6:b5:18","EdimaxTe_c6:b3:41","0.008189","EdimaxTe_c6:b5:18","EdimaxTe_c6:b3:41","ARP","60","144.22.3.1 is at 00:50:fc:c6:b5:18"
"15","EdimaxTe_c6:b3:41","Giga-Byt_63:54:91","0.008270","220.210.12.10","200.40.0.4","TCP","74","42450 > http [SYN] Seq=0 Win=5840 Len=0 MSS=1460 SACK_PERM=1 TSval=1924185 TSecr=0 WS=32"
"16","EdimaxTe_c6:b5:18","Broadcast","0.011339","EdimaxTe_c6:b5:18","Broadcast","ARP","60","Who has 200.40.0.4?  Tell 200.40.0.100"
"17","Giga-Byt_68:66:c2","EdimaxTe_c6:b5:18","0.011432","Giga-Byt_68:66:c2","EdimaxTe_c6:b5:18","ARP","60","200.40.0.4 is at 00:14:85:68:66:c2"
"18","EdimaxTe_c6:b5:18","Giga-Byt_68:66:c2","0.011522","220.210.12.10","200.40.0.4","TCP","74","42450 > http [SYN] Seq=0 Win=5840 Len=0 MSS=1460 SACK_PERM=1 TSval=1924185 TSecr=0 WS=32"
"19","Giga-Byt_68:66:c2","EdimaxTe_c6:b5:18","0.011640","200.40.0.4","220.210.12.10","TCP","74","http > 42450 [SYN, ACK] Seq=0 Ack=1 Win=5792 Len=0 MSS=1460 SACK_PERM=1 TSval=1758032 TSecr=1924185 WS=32"
"20","Giga-Byt_63:54:91","EdimaxTe_c6:b3:41","0.011730","200.40.0.4","220.210.12.10","TCP","74","http > 42450 [SYN, ACK] Seq=0 Ack=1 Win=5792 Len=0 MSS=1460 SACK_PERM=1 TSval=1758032 TSecr=1924185 WS=32"
"21","Giga-Byt_68:a0:74","Giga-Byt_68:6f:e0","0.011819","200.40.0.4","220.210.12.10","TCP","74","http > 42450 [SYN, ACK] Seq=0 Ack=1 Win=5792 Len=0 MSS=1460 SACK_PERM=1 TSval=1758032 TSecr=1924185 WS=32"
"22","Giga-Byt_68:6f:e0","EdimaxTe_c6:b3:41","0.011914","220.210.12.10","200.40.0.4","TCP","66","42450 > http [ACK] Seq=1 Ack=1 Win=5856 Len=0 TSval=1924187 TSecr=1758032"
"23","EdimaxTe_c6:b3:41","Giga-Byt_63:54:91","0.011995","220.210.12.10","200.40.0.4","TCP","66","[TCP Dup ACK 22#1] 42450 > http [ACK] Seq=1 Ack=1 Win=5856 Len=0 TSval=1924187 TSecr=1758032"
"24","Giga-Byt_68:6f:e0","EdimaxTe_c6:b3:41","0.012477","220.210.12.10","200.40.0.4","HTTP","567","GET /96363.html HTTP/1.0 "
"25","EdimaxTe_c6:b5:18","Giga-Byt_68:66:c2","0.012548","220.210.12.10","200.40.0.4","TCP","66","42450 > http [ACK] Seq=1 Ack=1 Win=5856 Len=0 TSval=1924187 TSecr=1758032"
"26","EdimaxTe_c6:b3:41","Giga-Byt_63:54:91","0.013028","220.210.12.10","200.40.0.4","HTTP","567","[TCP Retransmission] GET /96363.html HTTP/1.0 "
"27","EdimaxTe_c6:b5:18","Giga-Byt_68:66:c2","0.013515","220.210.12.10","200.40.0.4","HTTP","567","[TCP Retransmission] GET /96363.html HTTP/1.0 "
"28","Giga-Byt_68:66:c2","EdimaxTe_c6:b5:18","0.013625","200.40.0.4","220.210.12.10","TCP","66","http > 42450 [ACK] Seq=1 Ack=502 Win=6880 Len=0 TSval=1758033 TSecr=1924187"
"29","Giga-Byt_63:54:91","EdimaxTe_c6:b3:41","0.013706","200.40.0.4","220.210.12.10","TCP","66","[TCP Dup ACK 28#1] http > 42450 [ACK] Seq=1 Ack=502 Win=6880 Len=0 TSval=1758033 TSecr=1924187"
"30","Giga-Byt_68:a0:74","Giga-Byt_68:6f:e0","0.013786","200.40.0.4","220.210.12.10","TCP","66","[TCP Dup ACK 28#2] http > 42450 [ACK] Seq=1 Ack=502 Win=6880 Len=0 TSval=1758033 TSecr=1924187"
"31","Giga-Byt_68:66:c2","EdimaxTe_c6:b5:18","0.015648","200.40.0.4","220.210.12.10","HTTP","1462","HTTP/1.1 200 OK  (text/html)"
"32","Giga-Byt_63:54:91","EdimaxTe_c6:b3:41","0.016862","200.40.0.4","220.210.12.10","HTTP","1462","[TCP Retransmission] HTTP/1.1 200 OK  (text/html)"
"33","Giga-Byt_68:a0:74","Giga-Byt_68:6f:e0","0.018075","200.40.0.4","220.210.12.10","HTTP","1462","[TCP Retransmission] HTTP/1.1 200 OK  (text/html)"
"34","Giga-Byt_68:6f:e0","EdimaxTe_c6:b3:41","0.018160","220.210.12.10","200.40.0.4","TCP","66","42450 > http [ACK] Seq=502 Ack=1397 Win=8736 Len=0 TSval=1924188 TSecr=1758033"
"35","EdimaxTe_c6:b3:41","Giga-Byt_63:54:91","0.018241","220.210.12.10","200.40.0.4","TCP","66","[TCP Dup ACK 34#1] 42450 > http [ACK] Seq=502 Ack=1397 Win=8736 Len=0 TSval=1924188 TSecr=1758033"
"36","EdimaxTe_c6:b5:18","Giga-Byt_68:66:c2","0.018321","220.210.12.10","200.40.0.4","TCP","66","[TCP Dup ACK 34#2] 42450 > http [ACK] Seq=502 Ack=1397 Win=8736 Len=0 TSval=1924188 TSecr=1758033"
"37","Giga-Byt_68:6f:e0","Netronix_aa:35:6f","0.019114","220.210.12.10","220.210.12.101","TCP","556","[TCP segment of a reassembled PDU]"
"38","Giga-Byt_68:6f:e0","Netronix_aa:35:6f","0.020036","220.210.12.10","220.210.12.101","HTTP","1122","HTTP/1.0 200 OK  (text/html)"
"39","Giga-Byt_69:65:54","Giga-Byt_69:40:4d","0.020498","220.210.12.10","10.10.0.10","TCP","556","[TCP segment of a reassembled PDU]"
"40","Giga-Byt_69:65:54","Giga-Byt_69:40:4d","0.021420","220.210.12.10","10.10.0.10","HTTP","1122","HTTP/1.0 200 OK  (text/html)"
"41","Giga-Byt_69:40:4d","Netronix_aa:35:6f","0.021486","10.10.0.10","220.210.12.10","TCP","66","41730 > ndl-aas [ACK] Seq=426 Ack=491 Win=2003 Len=0 TSval=1239022 TSecr=1924189"
"42","Giga-Byt_69:40:4d","Netronix_aa:35:6f","0.021557","10.10.0.10","220.210.12.10","TCP","66","41730 > ndl-aas [ACK] Seq=426 Ack=1547 Win=2003 Len=0 TSval=1239022 TSecr=1924189"
"43","Netronix_aa:35:6f","Giga-Byt_68:6f:e0","0.021631","220.210.12.101","220.210.12.10","TCP","66","41730 > ndl-aas [ACK] Seq=426 Ack=491 Win=2003 Len=0 TSval=1239022 TSecr=1924189"
"44","Netronix_aa:35:6f","Giga-Byt_68:6f:e0","0.021704","220.210.12.101","220.210.12.10","TCP","66","41730 > ndl-aas [ACK] Seq=426 Ack=1547 Win=2003 Len=0 TSval=1239022 TSecr=1924189"
"45","Giga-Byt_69:40:4d","Netronix_aa:35:6f","0.035305","10.10.0.10","220.210.12.10","HTTP","506","GET http://web2.isptyr.com/96363-1.jpg HTTP/1.1 "
"46","Giga-Byt_69:40:4d","Netronix_aa:35:6f","0.035728","10.10.0.10","220.210.12.10","HTTP","506","GET http://web2.isptyr.com/96363-2.jpg HTTP/1.1 "
"47","Netronix_aa:35:6f","Giga-Byt_68:6f:e0","0.036155","220.210.12.101","220.210.12.10","HTTP","506","GET http://web2.isptyr.com/96363-1.jpg HTTP/1.1 "
"48","Netronix_aa:35:6f","Giga-Byt_68:6f:e0","0.036578","220.210.12.101","220.210.12.10","HTTP","506","GET http://web2.isptyr.com/96363-2.jpg HTTP/1.1 "
"49","Giga-Byt_68:6f:e0","EdimaxTe_c6:b3:41","0.036656","220.210.12.10","200.40.0.3","TCP","74","52108 > http [SYN] Seq=0 Win=5840 Len=0 MSS=1460 SACK_PERM=1 TSval=1924193 TSecr=0 WS=32"
"50","Giga-Byt_68:6f:e0","EdimaxTe_c6:b3:41","0.036750","220.210.12.10","200.40.0.3","TCP","74","47352 > http [SYN] Seq=0 Win=5840 Len=0 MSS=1460 SACK_PERM=1 TSval=1924193 TSecr=0 WS=32"
"51","EdimaxTe_c6:b3:41","Giga-Byt_63:54:91","0.036832","220.210.12.10","200.40.0.3","TCP","74","52108 > http [SYN] Seq=0 Win=5840 Len=0 MSS=1460 SACK_PERM=1 TSval=1924193 TSecr=0 WS=32"
"52","EdimaxTe_c6:b3:41","Giga-Byt_63:54:91","0.036910","220.210.12.10","200.40.0.3","TCP","74","47352 > http [SYN] Seq=0 Win=5840 Len=0 MSS=1460 SACK_PERM=1 TSval=1924193 TSecr=0 WS=32"
"53","EdimaxTe_c6:b5:18","Broadcast","0.039340","EdimaxTe_c6:b5:18","Broadcast","ARP","60","Who has 200.40.0.3?  Tell 200.40.0.100"
"54","Giga-Byt_65:cd:be","EdimaxTe_c6:b5:18","0.039422","Giga-Byt_65:cd:be","EdimaxTe_c6:b5:18","ARP","60","200.40.0.3 is at 00:14:85:65:cd:be"
"55","EdimaxTe_c6:b5:18","Giga-Byt_65:cd:be","0.039512","220.210.12.10","200.40.0.3","TCP","74","52108 > http [SYN] Seq=0 Win=5840 Len=0 MSS=1460 SACK_PERM=1 TSval=1924193 TSecr=0 WS=32"
"56","EdimaxTe_c6:b5:18","Giga-Byt_65:cd:be","0.039591","220.210.12.10","200.40.0.3","TCP","74","47352 > http [SYN] Seq=0 Win=5840 Len=0 MSS=1460 SACK_PERM=1 TSval=1924193 TSecr=0 WS=32"
"57","Giga-Byt_65:cd:be","EdimaxTe_c6:b5:18","0.039672","200.40.0.3","220.210.12.10","TCP","74","http > 52108 [SYN, ACK] Seq=0 Ack=1 Win=5792 Len=0 MSS=1460 SACK_PERM=1 TSval=820455 TSecr=1924193 WS=32"
"58","Giga-Byt_65:cd:be","EdimaxTe_c6:b5:18","0.039750","200.40.0.3","220.210.12.10","TCP","74","http > 47352 [SYN, ACK] Seq=0 Ack=1 Win=5792 Len=0 MSS=1460 SACK_PERM=1 TSval=820455 TSecr=1924193 WS=32"
"59","Giga-Byt_63:54:91","EdimaxTe_c6:b3:41","0.039832","200.40.0.3","220.210.12.10","TCP","74","http > 52108 [SYN, ACK] Seq=0 Ack=1 Win=5792 Len=0 MSS=1460 SACK_PERM=1 TSval=820455 TSecr=1924193 WS=32"
"60","Giga-Byt_63:54:91","EdimaxTe_c6:b3:41","0.039910","200.40.0.3","220.210.12.10","TCP","74","http > 47352 [SYN, ACK] Seq=0 Ack=1 Win=5792 Len=0 MSS=1460 SACK_PERM=1 TSval=820455 TSecr=1924193 WS=32"
"61","Giga-Byt_68:a0:74","Giga-Byt_68:6f:e0","0.039992","200.40.0.3","220.210.12.10","TCP","74","http > 52108 [SYN, ACK] Seq=0 Ack=1 Win=5792 Len=0 MSS=1460 SACK_PERM=1 TSval=820455 TSecr=1924193 WS=32"
"62","Giga-Byt_68:a0:74","Giga-Byt_68:6f:e0","0.040071","200.40.0.3","220.210.12.10","TCP","74","http > 47352 [SYN, ACK] Seq=0 Ack=1 Win=5792 Len=0 MSS=1460 SACK_PERM=1 TSval=820455 TSecr=1924193 WS=32"
"63","Giga-Byt_68:6f:e0","EdimaxTe_c6:b3:41","0.040145","220.210.12.10","200.40.0.3","TCP","66","52108 > http [ACK] Seq=1 Ack=1 Win=5856 Len=0 TSval=1924194 TSecr=820455"
"64","Giga-Byt_68:6f:e0","EdimaxTe_c6:b3:41","0.040218","220.210.12.10","200.40.0.3","TCP","66","47352 > http [ACK] Seq=1 Ack=1 Win=5856 Len=0 TSval=1924194 TSecr=820455"
"65","EdimaxTe_c6:b3:41","Giga-Byt_63:54:91","0.040315","220.210.12.10","200.40.0.3","TCP","66","[TCP Dup ACK 63#1] 52108 > http [ACK] Seq=1 Ack=1 Win=5856 Len=0 TSval=1924194 TSecr=820455"
"66","Giga-Byt_68:6f:e0","EdimaxTe_c6:b3:41","0.040875","220.210.12.10","200.40.0.3","HTTP","582","GET /96363-1.jpg HTTP/1.0 "
"67","Giga-Byt_68:6f:e0","EdimaxTe_c6:b3:41","0.041423","220.210.12.10","200.40.0.3","HTTP","582","GET /96363-2.jpg HTTP/1.0 "
"68","EdimaxTe_c6:b5:18","Giga-Byt_65:cd:be","0.041493","220.210.12.10","200.40.0.3","TCP","66","52108 > http [ACK] Seq=1 Ack=1 Win=5856 Len=0 TSval=1924194 TSecr=820455"
"69","EdimaxTe_c6:b3:41","Giga-Byt_63:54:91","0.041622","220.210.12.10","200.40.0.3","TCP","66","47352 > http [ACK] Seq=1 Ack=1 Win=5856 Len=0 TSval=1924194 TSecr=820455"
"70","EdimaxTe_c6:b3:41","Giga-Byt_63:54:91","0.042112","220.210.12.10","200.40.0.3","HTTP","582","[TCP Retransmission] GET /96363-1.jpg HTTP/1.0 "
"71","EdimaxTe_c6:b3:41","Giga-Byt_63:54:91","0.042597","220.210.12.10","200.40.0.3","HTTP","582","[TCP Retransmission] GET /96363-2.jpg HTTP/1.0 "
"72","EdimaxTe_c6:b5:18","Giga-Byt_65:cd:be","0.042666","220.210.12.10","200.40.0.3","TCP","66","47352 > http [ACK] Seq=1 Ack=1 Win=5856 Len=0 TSval=1924194 TSecr=820455"
"73","EdimaxTe_c6:b5:18","Giga-Byt_65:cd:be","0.043156","220.210.12.10","200.40.0.3","HTTP","582","[TCP Retransmission] GET /96363-1.jpg HTTP/1.0 "
"74","EdimaxTe_c6:b5:18","Giga-Byt_65:cd:be","0.043641","220.210.12.10","200.40.0.3","HTTP","582","[TCP Retransmission] GET /96363-2.jpg HTTP/1.0 "
"75","Giga-Byt_65:cd:be","EdimaxTe_c6:b5:18","0.043710","200.40.0.3","220.210.12.10","TCP","66","http > 52108 [ACK] Seq=1 Ack=517 Win=6880 Len=0 TSval=820456 TSecr=1924194"
"76","Giga-Byt_65:cd:be","EdimaxTe_c6:b5:18","0.043782","200.40.0.3","220.210.12.10","TCP","66","http > 47352 [ACK] Seq=1 Ack=517 Win=6880 Len=0 TSval=820456 TSecr=1924194"
"77","Giga-Byt_63:54:91","EdimaxTe_c6:b3:41","0.043858","200.40.0.3","220.210.12.10","TCP","66","[TCP Dup ACK 75#1] http > 52108 [ACK] Seq=1 Ack=517 Win=6880 Len=0 TSval=820456 TSecr=1924194"
"78","Giga-Byt_63:54:91","EdimaxTe_c6:b3:41","0.043929","200.40.0.3","220.210.12.10","TCP","66","[TCP Dup ACK 76#1] http > 47352 [ACK] Seq=1 Ack=517 Win=6880 Len=0 TSval=820456 TSecr=1924194"
"79","Giga-Byt_68:a0:74","Giga-Byt_68:6f:e0","0.044005","200.40.0.3","220.210.12.10","TCP","66","[TCP Dup ACK 75#2] http > 52108 [ACK] Seq=1 Ack=517 Win=6880 Len=0 TSval=820456 TSecr=1924194"
"80","Giga-Byt_68:a0:74","Giga-Byt_68:6f:e0","0.044077","200.40.0.3","220.210.12.10","TCP","66","[TCP Dup ACK 76#2] http > 47352 [ACK] Seq=1 Ack=517 Win=6880 Len=0 TSval=820456 TSecr=1924194"
"81","Giga-Byt_65:cd:be","EdimaxTe_c6:b5:18","0.058127","200.40.0.3","220.210.12.10","TCP","1514","[TCP segment of a reassembled PDU]"
"82","Giga-Byt_65:cd:be","EdimaxTe_c6:b5:18","0.058588","200.40.0.3","220.210.12.10","HTTP","565","HTTP/1.1 200 OK  (JPEG JFIF image)"
"83","Giga-Byt_63:54:91","EdimaxTe_c6:b3:41","0.059830","200.40.0.3","220.210.12.10","TCP","1514","[TCP Out-Of-Order] http > 52108 [ACK] Seq=1 Ack=517 Win=6880 Len=1448 TSval=820459 TSecr=1924194"
"84","Giga-Byt_63:54:91","EdimaxTe_c6:b3:41","0.060292","200.40.0.3","220.210.12.10","TCP","565","[TCP Retransmission] [TCP segment of a reassembled PDU]"
"85","Giga-Byt_68:a0:74","Giga-Byt_68:6f:e0","0.061534","200.40.0.3","220.210.12.10","TCP","1514","[TCP Out-Of-Order] http > 52108 [ACK] Seq=1 Ack=517 Win=6880 Len=1448 TSval=820459 TSecr=1924194"
"86","Giga-Byt_68:a0:74","Giga-Byt_68:6f:e0","0.061997","200.40.0.3","220.210.12.10","TCP","565","[TCP Retransmission] [TCP segment of a reassembled PDU]"
"87","Giga-Byt_68:6f:e0","EdimaxTe_c6:b3:41","0.062242","220.210.12.10","200.40.0.3","TCP","66","52108 > http [ACK] Seq=517 Ack=1449 Win=8736 Len=0 TSval=1924199 TSecr=820459"
"88","EdimaxTe_c6:b3:41","Giga-Byt_63:54:91","0.062339","220.210.12.10","200.40.0.3","TCP","66","[TCP Dup ACK 87#1] 52108 > http [ACK] Seq=517 Ack=1449 Win=8736 Len=0 TSval=1924199 TSecr=820459"
"89","Giga-Byt_68:6f:e0","Netronix_aa:35:6f","0.062775","220.210.12.10","220.210.12.101","TCP","510","[TCP segment of a reassembled PDU]"
"90","Giga-Byt_65:cd:be","EdimaxTe_c6:b5:18","0.064063","200.40.0.3","220.210.12.10","TCP","1514","[TCP segment of a reassembled PDU]"
"91","Giga-Byt_69:65:54","Giga-Byt_69:40:4d","0.064597","220.210.12.10","10.10.0.10","TCP","510","[TCP segment of a reassembled PDU]"
"92","Giga-Byt_69:40:4d","Netronix_aa:35:6f","0.064753","10.10.0.10","220.210.12.10","TCP","66","41732 > ndl-aas [ACK] Seq=441 Ack=445 Win=451 Len=0 TSval=1239033 TSecr=1924199"
"93","Giga-Byt_68:6f:e0","Netronix_aa:35:6f","0.065762","220.210.12.10","220.210.12.101","TCP","1220","[TCP segment of a reassembled PDU]"
"94","Netronix_aa:35:6f","Giga-Byt_68:6f:e0","0.065894","220.210.12.101","220.210.12.10","TCP","66","41732 > ndl-aas [ACK] Seq=441 Ack=445 Win=451 Len=0 TSval=1239033 TSecr=1924199"
"95","Giga-Byt_63:54:91","EdimaxTe_c6:b3:41","0.067141","200.40.0.3","220.210.12.10","TCP","1514","[TCP Retransmission] http > 47352 [ACK] Seq=1 Ack=517 Win=6880 Len=1448 TSval=820461 TSecr=1924194"
"96","Giga-Byt_68:a0:74","Giga-Byt_68:6f:e0","0.068397","200.40.0.3","220.210.12.10","TCP","1514","[TCP Retransmission] http > 47352 [ACK] Seq=1 Ack=517 Win=6880 Len=1448 TSval=820461 TSecr=1924194"
"97","Giga-Byt_68:6f:e0","EdimaxTe_c6:b3:41","0.068503","220.210.12.10","200.40.0.3","TCP","66","52108 > http [ACK] Seq=517 Ack=1948 Win=11648 Len=0 TSval=1924199 TSecr=820459"
"98","Giga-Byt_68:6f:e0","Netronix_aa:35:6f","0.068980","220.210.12.10","220.210.12.101","HTTP","565","HTTP/1.0 200 OK  (JPEG JFIF image)"
"99","Giga-Byt_68:6f:e0","EdimaxTe_c6:b3:41","0.069095","220.210.12.10","200.40.0.3","TCP","66","47352 > http [ACK] Seq=517 Ack=1449 Win=8736 Len=0 TSval=1924201 TSecr=820461"
"100","Giga-Byt_68:6f:e0","Netronix_aa:35:6f","0.069528","220.210.12.10","220.210.12.101","TCP","510","[TCP segment of a reassembled PDU]"
"101","Giga-Byt_68:6f:e0","Netronix_aa:35:6f","0.070591","220.210.12.10","220.210.12.101","TCP","1220","[TCP segment of a reassembled PDU]"
"102","EdimaxTe_c6:b3:41","Giga-Byt_63:54:91","0.071245","220.210.12.10","200.40.0.3","TCP","66","[TCP Dup ACK 97#1] 52108 > http [ACK] Seq=517 Ack=1948 Win=11648 Len=0 TSval=1924199 TSecr=820459"
"103","EdimaxTe_c6:b3:41","Giga-Byt_63:54:91","0.071379","220.210.12.10","200.40.0.3","TCP","66","[TCP Dup ACK 99#1] 47352 > http [ACK] Seq=517 Ack=1449 Win=8736 Len=0 TSval=1924201 TSecr=820461"
"104","Giga-Byt_65:cd:be","EdimaxTe_c6:b5:18","0.077504","200.40.0.3","220.210.12.10","HTTP","1475","HTTP/1.1 200 OK  (JPEG JFIF image)"
"105","Giga-Byt_69:65:54","Giga-Byt_69:40:4d","0.078501","220.210.12.10","10.10.0.10","TCP","1220","[TCP segment of a reassembled PDU]"
"106","Giga-Byt_69:65:54","Giga-Byt_69:40:4d","0.078991","220.210.12.10","10.10.0.10","HTTP","565","HTTP/1.0 200 OK  (JPEG JFIF image)"
"107","Giga-Byt_63:54:91","EdimaxTe_c6:b3:41","0.080318","200.40.0.3","220.210.12.10","TCP","1475","[TCP Retransmission] [TCP segment of a reassembled PDU]"
"108","Giga-Byt_68:a0:74","Giga-Byt_68:6f:e0","0.081606","200.40.0.3","220.210.12.10","TCP","1475","[TCP Retransmission] [TCP segment of a reassembled PDU]"
"109","Giga-Byt_68:6f:e0","EdimaxTe_c6:b3:41","0.081691","220.210.12.10","200.40.0.3","TCP","66","47352 > http [ACK] Seq=517 Ack=2858 Win=11648 Len=0 TSval=1924204 TSecr=820461"
"110","EdimaxTe_c6:b3:41","Giga-Byt_63:54:91","0.081771","220.210.12.10","200.40.0.3","TCP","66","[TCP Dup ACK 109#1] 47352 > http [ACK] Seq=517 Ack=2858 Win=11648 Len=0 TSval=1924204 TSecr=820461"
"111","Giga-Byt_68:6f:e0","Netronix_aa:35:6f","0.082987","220.210.12.10","220.210.12.101","HTTP","1475","HTTP/1.0 200 OK  (JPEG JFIF image)"
"112","Giga-Byt_69:40:4d","Netronix_aa:35:6f","0.084535","10.10.0.10","220.210.12.10","TCP","66","41732 > ndl-aas [ACK] Seq=441 Ack=1599 Win=542 Len=0 TSval=1239036 TSecr=1924199"
"113","Giga-Byt_69:40:4d","Netronix_aa:35:6f","0.084606","10.10.0.10","220.210.12.10","TCP","66","41732 > ndl-aas [ACK] Seq=441 Ack=2098 Win=614 Len=0 TSval=1239036 TSecr=1924200"
"114","Netronix_aa:35:6f","Giga-Byt_68:6f:e0","0.084703","220.210.12.101","220.210.12.10","TCP","66","41732 > ndl-aas [ACK] Seq=441 Ack=1599 Win=542 Len=0 TSval=1239036 TSecr=1924199"
"115","Netronix_aa:35:6f","Giga-Byt_68:6f:e0","0.084775","220.210.12.101","220.210.12.10","TCP","66","41732 > ndl-aas [ACK] Seq=441 Ack=2098 Win=614 Len=0 TSval=1239036 TSecr=1924200"
"116","Giga-Byt_69:65:54","Giga-Byt_69:40:4d","0.087098","220.210.12.10","10.10.0.10","TCP","510","[TCP segment of a reassembled PDU]"
"117","Giga-Byt_69:65:54","Giga-Byt_69:40:4d","0.088100","220.210.12.10","10.10.0.10","TCP","1220","[TCP segment of a reassembled PDU]"
"118","Giga-Byt_69:65:54","Giga-Byt_69:40:4d","0.089302","220.210.12.10","10.10.0.10","HTTP","1475","HTTP/1.0 200 OK  (JPEG JFIF image)"
"119","Giga-Byt_69:40:4d","Netronix_aa:35:6f","0.089364","10.10.0.10","220.210.12.10","TCP","66","41730 > ndl-aas [ACK] Seq=866 Ack=3145 Win=2003 Len=0 TSval=1239039 TSecr=1924201"
"120","Netronix_aa:35:6f","Giga-Byt_68:6f:e0","0.089447","220.210.12.101","220.210.12.10","TCP","66","41730 > ndl-aas [ACK] Seq=866 Ack=3145 Win=2003 Len=0 TSval=1239039 TSecr=1924201"
"121","Giga-Byt_69:40:4d","Netronix_aa:35:6f","0.127976","10.10.0.10","220.210.12.10","TCP","66","41730 > ndl-aas [ACK] Seq=866 Ack=4554 Win=2003 Len=0 TSval=1239049 TSecr=1924204"
"122","Netronix_aa:35:6f","Giga-Byt_68:6f:e0","0.128061","220.210.12.101","220.210.12.10","TCP","66","41730 > ndl-aas [ACK] Seq=866 Ack=4554 Win=2003 Len=0 TSval=1239049 TSecr=1924204"
"123","EdimaxTe_c6:b5:18","Giga-Byt_65:cd:be","0.132459","220.210.12.10","200.40.0.3","TCP","66","52108 > http [ACK] Seq=517 Ack=1449 Win=8736 Len=0 TSval=1924199 TSecr=820459"
"124","EdimaxTe_c6:b5:18","Giga-Byt_65:cd:be","0.132531","220.210.12.10","200.40.0.3","TCP","66","52108 > http [ACK] Seq=517 Ack=1948 Win=11648 Len=0 TSval=1924199 TSecr=820459"
"125","EdimaxTe_c6:b5:18","Giga-Byt_65:cd:be","0.132602","220.210.12.10","200.40.0.3","TCP","66","47352 > http [ACK] Seq=517 Ack=1449 Win=8736 Len=0 TSval=1924201 TSecr=820461"
"126","EdimaxTe_c6:b5:18","Giga-Byt_65:cd:be","0.132675","220.210.12.10","200.40.0.3","TCP","66","47352 > http [ACK] Seq=517 Ack=2858 Win=11648 Len=0 TSval=1924204 TSecr=820461"
"127","Giga-Byt_68:a0:74","Giga-Byt_68:6f:e0","5.008226","Giga-Byt_68:a0:74","Giga-Byt_68:6f:e0","ARP","60","Who has 220.210.12.10?  Tell 220.210.12.100 (duplicate use of 220.210.12.100 detected!)"
"128","Giga-Byt_68:6f:e0","Giga-Byt_68:a0:74","5.008327","Giga-Byt_68:6f:e0","Giga-Byt_68:a0:74","ARP","60","220.210.12.10 is at 00:14:85:68:6f:e0 (duplicate use of 220.210.12.100 detected!)"
"129","Giga-Byt_69:65:54","Giga-Byt_69:40:4d","5.016697","Giga-Byt_69:65:54","Giga-Byt_69:40:4d","ARP","60","Who has 10.10.0.10?  Tell 10.10.0.100 (duplicate use of 10.10.0.100 detected!)"
"130","Giga-Byt_69:40:4d","Giga-Byt_69:65:54","5.016807","Giga-Byt_69:40:4d","Giga-Byt_69:65:54","ARP","60","10.10.0.10 is at 00:14:85:69:40:4d (duplicate use of 10.10.0.100 detected!)"
"131","Giga-Byt_68:66:c2","EdimaxTe_c6:b5:18","15.028654","200.40.0.4","220.210.12.10","TCP","66","http > 42450 [FIN, ACK] Seq=1397 Ack=502 Win=6880 Len=0 TSval=1761787 TSecr=1924188"
"132","Giga-Byt_63:54:91","EdimaxTe_c6:b3:41","15.028755","200.40.0.4","220.210.12.10","TCP","66","http > 42450 [FIN, ACK] Seq=1397 Ack=502 Win=6880 Len=0 TSval=1761787 TSecr=1924188"
"133","Giga-Byt_68:a0:74","Giga-Byt_68:6f:e0","15.028857","200.40.0.4","220.210.12.10","TCP","66","http > 42450 [FIN, ACK] Seq=1397 Ack=502 Win=6880 Len=0 TSval=1761787 TSecr=1924188"
"134","Giga-Byt_68:6f:e0","Giga-Byt_68:a0:74","15.029044","220.210.12.10","200.40.0.4","TCP","66","42450 > http [FIN, ACK] Seq=502 Ack=1398 Win=8736 Len=0 TSval=1927941 TSecr=1761787"
"135","EdimaxTe_c6:b3:41","Giga-Byt_63:54:91","15.029129","220.210.12.10","200.40.0.4","TCP","66","42450 > http [FIN, ACK] Seq=502 Ack=1398 Win=8736 Len=0 TSval=1927941 TSecr=1761787"
"136","EdimaxTe_c6:b5:18","Giga-Byt_68:66:c2","15.029211","220.210.12.10","200.40.0.4","TCP","66","42450 > http [FIN, ACK] Seq=502 Ack=1398 Win=8736 Len=0 TSval=1927941 TSecr=1761787"
"137","Giga-Byt_68:66:c2","EdimaxTe_c6:b5:18","15.029323","200.40.0.4","220.210.12.10","TCP","66","http > 42450 [ACK] Seq=1398 Ack=503 Win=6880 Len=0 TSval=1761787 TSecr=1927941"
"138","Giga-Byt_63:54:91","EdimaxTe_c6:b3:41","15.029404","200.40.0.4","220.210.12.10","TCP","66","[TCP Dup ACK 137#1] http > 42450 [ACK] Seq=1398 Ack=503 Win=6880 Len=0 TSval=1761787 TSecr=1927941"
"139","Giga-Byt_68:a0:74","Giga-Byt_68:6f:e0","15.029486","200.40.0.4","220.210.12.10","TCP","66","[TCP Dup ACK 137#2] http > 42450 [ACK] Seq=1398 Ack=503 Win=6880 Len=0 TSval=1761787 TSecr=1927941"
"140","Giga-Byt_65:cd:be","EdimaxTe_c6:b5:18","15.070596","200.40.0.3","220.210.12.10","TCP","66","http > 52108 [FIN, ACK] Seq=1948 Ack=517 Win=6880 Len=0 TSval=824213 TSecr=1924199"
"141","Giga-Byt_65:cd:be","EdimaxTe_c6:b5:18","15.070667","200.40.0.3","220.210.12.10","TCP","66","http > 47352 [FIN, ACK] Seq=2858 Ack=517 Win=6880 Len=0 TSval=824213 TSecr=1924204"
"142","Giga-Byt_63:54:91","EdimaxTe_c6:b3:41","15.070742","200.40.0.3","220.210.12.10","TCP","66","http > 52108 [FIN, ACK] Seq=1948 Ack=517 Win=6880 Len=0 TSval=824213 TSecr=1924199"
"143","Giga-Byt_63:54:91","EdimaxTe_c6:b3:41","15.070814","200.40.0.3","220.210.12.10","TCP","66","http > 47352 [FIN, ACK] Seq=2858 Ack=517 Win=6880 Len=0 TSval=824213 TSecr=1924204"
"144","Giga-Byt_68:a0:74","Giga-Byt_68:6f:e0","15.070891","200.40.0.3","220.210.12.10","TCP","66","http > 52108 [FIN, ACK] Seq=1948 Ack=517 Win=6880 Len=0 TSval=824213 TSecr=1924199"
"145","Giga-Byt_68:a0:74","Giga-Byt_68:6f:e0","15.070962","200.40.0.3","220.210.12.10","TCP","66","http > 47352 [FIN, ACK] Seq=2858 Ack=517 Win=6880 Len=0 TSval=824213 TSecr=1924204"
"146","Giga-Byt_68:6f:e0","Giga-Byt_68:a0:74","15.071037","220.210.12.10","200.40.0.3","TCP","66","52108 > http [FIN, ACK] Seq=517 Ack=1949 Win=11648 Len=0 TSval=1927952 TSecr=824213"
"147","Giga-Byt_68:6f:e0","Giga-Byt_68:a0:74","15.071109","220.210.12.10","200.40.0.3","TCP","66","47352 > http [FIN, ACK] Seq=517 Ack=2859 Win=11648 Len=0 TSval=1927952 TSecr=824213"
"148","EdimaxTe_c6:b3:41","Giga-Byt_63:54:91","15.071184","220.210.12.10","200.40.0.3","TCP","66","52108 > http [FIN, ACK] Seq=517 Ack=1949 Win=11648 Len=0 TSval=1927952 TSecr=824213"
"149","EdimaxTe_c6:b3:41","Giga-Byt_63:54:91","15.071256","220.210.12.10","200.40.0.3","TCP","66","47352 > http [FIN, ACK] Seq=517 Ack=2859 Win=11648 Len=0 TSval=1927952 TSecr=824213"
"150","EdimaxTe_c6:b5:18","Giga-Byt_65:cd:be","15.071330","220.210.12.10","200.40.0.3","TCP","66","52108 > http [FIN, ACK] Seq=517 Ack=1949 Win=11648 Len=0 TSval=1927952 TSecr=824213"
"151","EdimaxTe_c6:b5:18","Giga-Byt_65:cd:be","15.071402","220.210.12.10","200.40.0.3","TCP","66","47352 > http [FIN, ACK] Seq=517 Ack=2859 Win=11648 Len=0 TSval=1927952 TSecr=824213"
"152","Giga-Byt_65:cd:be","EdimaxTe_c6:b5:18","15.071478","200.40.0.3","220.210.12.10","TCP","66","http > 52108 [ACK] Seq=1949 Ack=518 Win=6880 Len=0 TSval=824213 TSecr=1927952"
"153","Giga-Byt_65:cd:be","EdimaxTe_c6:b5:18","15.071550","200.40.0.3","220.210.12.10","TCP","66","http > 47352 [ACK] Seq=2859 Ack=518 Win=6880 Len=0 TSval=824213 TSecr=1927952"
"154","Giga-Byt_63:54:91","EdimaxTe_c6:b3:41","15.071626","200.40.0.3","220.210.12.10","TCP","66","[TCP Dup ACK 152#1] http > 52108 [ACK] Seq=1949 Ack=518 Win=6880 Len=0 TSval=824213 TSecr=1927952"
"155","Giga-Byt_63:54:91","EdimaxTe_c6:b3:41","15.071698","200.40.0.3","220.210.12.10","TCP","66","[TCP Dup ACK 153#1] http > 47352 [ACK] Seq=2859 Ack=518 Win=6880 Len=0 TSval=824213 TSecr=1927952"
"156","Giga-Byt_68:a0:74","Giga-Byt_68:6f:e0","15.071772","200.40.0.3","220.210.12.10","TCP","66","[TCP Dup ACK 152#2] http > 52108 [ACK] Seq=1949 Ack=518 Win=6880 Len=0 TSval=824213 TSecr=1927952"
"157","Giga-Byt_68:a0:74","Giga-Byt_68:6f:e0","15.071844","200.40.0.3","220.210.12.10","TCP","66","[TCP Dup ACK 153#2] http > 47352 [ACK] Seq=2859 Ack=518 Win=6880 Len=0 TSval=824213 TSecr=1927952"
